{
  "schemaVersion": 1,
  "id": "fixture-rogue-3-thief",
  "name": "Vessa Quickfinger",
  "edition": "2014",
  "classes": [{"classKey": "rogue", "subclassKey": "thief", "level": 3}],
  "race": {"key": "halfling", "subraceKey": "lightfoot-halfling", "name": "Lightfoot Halfling"},
  "background": {"key": null, "name": "Urchin"},
  "abilities": {"str": 8, "dex": 17, "con": 12, "int": 13, "wis": 10, "cha": 14},
  "saveProficiencies": ["dex", "int"],
  "skills": {"stealth": "expertise", "sleight-of-hand": "expertise", "acrobatics": "proficient", "perception": "proficient", "deception": "proficient", "investigation": "proficient"},
  "profBonusOverride": null,
  "ac": {"mode": "computed", "formula": "armor", "armorKey": "leather-armor", "shield": false, "bonus": 0},
  "speed": 25,
  "initiativeBonus": 0,
  "hp": {"max": 24, "damage": 0, "temp": 5},
  "hitDice": [{"die": 8, "total": 3, "used": 0}],
  "deathSaves": {"successes": 0, "failures": 0, "stable": false, "dead": false},
  "conditions": ["poisoned"],
  "exhaustion": 1,
  "concentration": null,
  "inspiration": true,
  "counters": [],
  "spellcasting": null,
  "attacks": [
    {"id": "rapier", "name": "Rapier", "group": "action", "ability": "dex", "proficient": true, "bonusOverride": null, "bonus": 0, "damage": "1d8", "damageType": "piercing", "damageBonusMode": "ability", "damageBonus": 0},
    {"id": "shortbow", "name": "Shortbow", "group": "action", "ability": "dex", "proficient": true, "bonusOverride": null, "bonus": 0, "damage": "1d6", "damageType": "piercing", "damageBonusMode": "ability", "damageBonus": 0},
    {"id": "sneak", "name": "Sneak Attack", "group": "other", "ability": "dex", "proficient": false, "bonusOverride": 0, "bonus": 0, "damage": "2d6", "damageType": null, "damageBonusMode": "none", "damageBonus": 0}
  ],
  "items": [],
  "currency": {"cp": 30, "sp": 0, "ep": 0, "gp": 9, "pp": 0},
  "notes": [],
  "meta": {"source": "manual"}
}
